search_engine,search_string,title,media,timestamp,link
Google,Tata Lawsuits,IT services' focus on building IP and platforms may trigger more lawsuits,Business Standard,10 Oct 2024,https://www.business-standard.com/technology/tech-news/it-services-focus-on-building-ip-and-platforms-may-trigger-more-lawsuits-124100901370_1.html
Google,Tata Lawsuits,"From Singur, Mistry, Tata Tapes to Wadia: 5 controversies during Ratan Tata’s tenure",The Indian Express,11 Oct 2024,https://indianexpress.com/article/business/ratan-tata-singur-mistry-tata-tapes-wadia-controversies-9613283/
Google,Tata Lawsuits,"More than 20 fired American workers have sued TCS, why and IT giant's response",Times of India,31 Mar 2024,https://timesofindia.indiatimes.com/technology/tech-news/more-than-20-fired-americans-workers-of-tcs-have-sued-the-company-what-are-the-allegations-and-it-giants-response/articleshow/108906267.cms
Google,Tata Lawsuits,"Tata Fired White US Workers in Favor of Visa Holders, Suit Says",Bloomberg Law News,9 Apr 2024,https://news.bloomberglaw.com/daily-labor-report/tata-fired-white-us-workers-in-favor-of-visa-holders-suit-says
Google,Tata Lawsuits,TCS accused of firing US workers in favour of Indians on H-1B visa,Business Standard,12 Apr 2024,https://www.business-standard.com/companies/news/tcs-accused-of-firing-us-workers-in-favour-of-indians-on-h-1b-visa-124041200156_1.html
Google,Tata Lawsuits,TCS Asked To Pay $210 Million Fine To DXC Technology In Trade Secrets Row,Outlook Business,27 Nov 2023,https://www.outlookbusiness.com/news/tcs-asked-to-pay-210-million-fine-to-dxc-technology-in-trade-secrets-row
Google,Tata Lawsuits,Dutch group threatens lawsuit over Tata Steel pollution,The Economic Times,24 Aug 2023,https://m.economictimes.com/industry/indl-goods/svs/steel/dutch-group-threatens-lawsuit-over-tata-steel-pollution/articleshow/103022889.cms
Google,Tata Lawsuits,TCS gets partial relief in racial discrimination lawsuit in US Court,mint,23 Aug 2023,https://www.livemint.com/companies/news/tata-group-tcs-gets-partial-relief-in-racial-discrimination-lawsuit-in-us-court-11692762412299.html
Google,Tata Lawsuits,"Third court case launched against Tata Steel, calls for closure",DutchNews.nl,27 May 2024,https://www.dutchnews.nl/2024/05/third-court-case-launched-against-tata-steel-calls-for-closure/
Google,Tata Lawsuits,US Supreme Court rejects Indian IT company's appeal in Epic trade secrets case,FierceHealthcare,21 Nov 2023,https://www.fiercehealthcare.com/health-tech/us-supreme-court-rejects-indian-it-companys-appeal-epic-trades-secret-case
Bing,Tata Lawsuits,Delhi High Court says Ratan Tata is a well-known personal name/mark that needs protection,Barandbench,6h,https://www.barandbench.com/news/delhi-high-court-says-ratan-tata-well-known-personal-name-mark-trademark-protection
Bing,Tata Lawsuits,"Delhi HC bars unauthorized use of Ratan Tata's name, logo for events",Msn,3d,https://www.msn.com/en-in/autos/news/delhi-hc-bars-unauthorized-use-of-ratan-tatas-name-logo-for-events/ar-AA1yAiKF?ocid=BingNewsVerp
Bing,Tata Lawsuits,Tata's Capital Foods sues Dabur over ‘Schezwan Chutney’ trademark: Report,Hindustantimes,25d,https://www.hindustantimes.com/business/tatas-capital-foods-sues-dabur-over-schezwan-chutney-trademark-report-101736930903962.html
Yahoo,Tata Lawsuits,India's TCS to take $125 million hit to Q3 earnings over US lawsuit,Reuters·  via Yahoo Finance,1 year ago,https://r.search.yahoo.com/_ylt=Awr49Wrx4qlnTLIjmybQtDMD;_ylu=Y29sbwNncTEEcG9zAzEEdnRpZAMEc2VjA3Ny/RV=2/RE=1739215729/RO=10/RU=https%3a%2f%2ffinance.yahoo.com%2fnews%2findias-tcs-125-million-hit-115115682.html%3ffr%3dsycsrp_catchall/RK=2/RS=xfCmNMSJ3Z3S3Qe2rcFGHhTXBwI-
Yahoo,Tata Lawsuits,Mama & Tata Influencer Candice Miller Saddled with Husband’s $33.6 Million Debt After His Death by Suicide: Report,People·  via Yahoo News,1 month ago,https://r.search.yahoo.com/_ylt=Awr49Wrx4qlnTLIjnSbQtDMD;_ylu=Y29sbwNncTEEcG9zAzIEdnRpZAMEc2VjA3Ny/RV=2/RE=1739215729/RO=10/RU=https%3a%2f%2fwww.yahoo.com%2fnews%2fmama-tata-influencer-candice-miller-224820000.html%3ffr%3dsycsrp_catchall/RK=2/RS=nBOTYqH3Lkw1QMrxVPQnn0yxUyU-
Yahoo,Tata Lawsuits,"Real estate mogul, husband of Mama + Tata influencer dead at 43",NY Post·  via Yahoo News,7 months ago,https://r.search.yahoo.com/_ylt=Awr49Wrx4qlnTLIjnybQtDMD;_ylu=Y29sbwNncTEEcG9zAzMEdnRpZAMEc2VjA3Ny/RV=2/RE=1739215729/RO=10/RU=https%3a%2f%2fwww.yahoo.com%2fnews%2freal-estate-mogul-husband-mama-191725327.html%3ffr%3dsycsrp_catchall/RK=2/RS=R0Z60N604Y2cUbbvr8gIEh9MRn8-
Yahoo,Tata Lawsuits,Mama & Tata Influencer Candice Miller Selling $15 Million Hamptons Home 1 Month After Husband Brandon's Death,People·  via AOL,6 months ago,https://r.search.yahoo.com/_ylt=Awr49Wrx4qlnTLIjoSbQtDMD;_ylu=Y29sbwNncTEEcG9zAzQEdnRpZAMEc2VjA3Ny/RV=2/RE=1739215729/RO=10/RU=https%3a%2f%2fwww.aol.com%2fmama-tata-influencer-candice-miller-170622813.html/RK=2/RS=PU6C_jFSqYkARPdTIDRrIdvCeM8-
Yahoo,Tata Lawsuits,Hundreds of Items Auctioned Off from Former Home of Mama & Tata Influencer Candice Miler After Late Husband’s Death,People·  via Yahoo News,1 month ago,https://r.search.yahoo.com/_ylt=Awr49Wrx4qlnTLIjoybQtDMD;_ylu=Y29sbwNncTEEcG9zAzUEdnRpZAMEc2VjA3Ny/RV=2/RE=1739215729/RO=10/RU=https%3a%2f%2fwww.yahoo.com%2fnews%2fmama-tata-influencer-candice-miller-162003406.html%3ffr%3dsycsrp_catchall/RK=2/RS=.s.gVVgkBHziWOhs15lAtgdJUUo-
Yahoo,Tata Lawsuits,TCS Revamps Organization Structure to Leverage Domain Knowledge,Bloomberg·  via Yahoo Finance,2 years ago,https://r.search.yahoo.com/_ylt=Awr49Wrx4qlnTLIjpSbQtDMD;_ylu=Y29sbwNncTEEcG9zAzYEdnRpZAMEc2VjA3Ny/RV=2/RE=1739215729/RO=10/RU=https%3a%2f%2ffinance.yahoo.com%2fnews%2ftcs-revamps-organization-structure-leverage-082432871.html%3ffr%3dsycsrp_catchall/RK=2/RS=4LmXk4FRe917M3tT4Sw2xc7oyrE-
Yahoo,Tata Lawsuits,Everything Apple says is wrong about the DOJ’s iPhone lawsuit,Digital Trends·  via Yahoo News,10 months ago,https://r.search.yahoo.com/_ylt=Awr49Wrx4qlnTLIjpybQtDMD;_ylu=Y29sbwNncTEEcG9zAzcEdnRpZAMEc2VjA3Ny/RV=2/RE=1739215729/RO=10/RU=https%3a%2f%2fwww.yahoo.com%2ftech%2feverything-apple-says-wrong-doj-180017657.html/RK=2/RS=gTAf3ogQf0psFc2pQIluYebO6j0-
Yahoo,Tata Lawsuits,Influencer Candice Miller selling personal items after late husband amassed $33.6m debt,The Independent·  via Yahoo News,1 month ago,https://r.search.yahoo.com/_ylt=Awr49Wrx4qlnTLIjqSbQtDMD;_ylu=Y29sbwNncTEEcG9zAzgEdnRpZAMEc2VjA3Ny/RV=2/RE=1739215729/RO=10/RU=https%3a%2f%2fwww.yahoo.com%2fnews%2finfluencer-candice-miller-selling-personal-181930540.html%3ffr%3dsycsrp_catchall/RK=2/RS=FoQL1gaBDOsr.08kw7QDlKilFSw-
Yahoo,Tata Lawsuits,"Messi still out, Suarez may rest for Inter Miami vs. Tigres Leagues Cup game in Houston",Miami Herald·  via Yahoo Sports,6 months ago,https://r.search.yahoo.com/_ylt=Awr49Wrx4qlnTLIjqybQtDMD;_ylu=Y29sbwNncTEEcG9zAzkEdnRpZAMEc2VjA3Ny/RV=2/RE=1739215729/RO=10/RU=https%3a%2f%2fsports.yahoo.com%2fmessi-still-suarez-may-rest-214315586.html%3ffr%3dsycsrp_catchall/RK=2/RS=ebExYo_iyeI5JxOhGudY2edcSWs-
Yahoo,Tata Lawsuits,Luxury Influencer Forced To Sell Her Belongings After Husband Ends His Life Amid Debt Crisis,Bored Panda·  via AOL,1 month ago,https://r.search.yahoo.com/_ylt=Awr49Wrx4qlnTLIjrSbQtDMD;_ylu=Y29sbwNncTEEcG9zAzEwBHZ0aWQDBHNlYwNzcg--/RV=2/RE=1739215729/RO=10/RU=https%3a%2f%2fwww.aol.com%2fluxury-influencer-husband-ended-life-212031289.html/RK=2/RS=2z9X2MUJC29lTiD1xEdyddcE4ag-
Google,Tata Merger,"Mohini Mohan Dutta: 'Mystery man' of Ratan Tata's will, set to get richer by Rs 500 crore due to...",India.Com,48 minutes ago,https://www.india.com/business/mohini-mohan-dutta-mystery-man-of-ratan-tatas-will-set-to-get-richer-by-rs-500-crore-due-to-mention-in-will-7605718/
Google,Tata Merger,"Tata Capital, Tata Motors Finance merger receives RBI's approval",Business Standard,14 Oct 2024,https://www.business-standard.com/companies/news/tata-capital-tata-motors-finance-merger-receives-rbi-s-approval-124101401020_1.html
Google,Tata Merger,"Tata Tech, just merge with Tata Elxsi",The Ken,1 week ago,https://the-ken.com/story/tata-tech-just-merge-with-tata-elxsi/
Google,Tata Merger,How are Tata Group companies linked? Why Tata Capital’s IPO could unlock value across conglomerate,Upstox,1 month ago,https://upstox.com/news/business-news/latest-updates/explained-why-tata-capital-s-potential-ipo-impacting-tata-group-stocks-how-are-the-companies-linked/article-136880/
Google,Tata Merger,NCLT asks two Tata NBFCs to seek merger nod from stakeholders,The Economic Times,7 Dec 2024,https://m.economictimes.com/industry/banking/finance/banking/nclt-asks-two-tata-nbfcs-to-seek-merger-nod-from-stakeholders/articleshow/116056343.cms
Google,Tata Merger,"Merger with Tata Motors Finance will broaden Tata Capital’s product portfolio, says Fitch",The Hindu BusinessLine,24 Jun 2024,https://www.thehindubusinessline.com/companies/merger-with-tata-motors-finance-will-broaden-tata-capitals-product-portfolio-says-fitch/article68327326.ece
Google,Tata Merger,Air India-Vistara Merger: Strategic Win or Tata’s Gamble?,Skift,17 Sept 2024,https://skift.com/2024/09/17/air-india-vistara-merger-strategic-win-or-tatas-gamble/
Google,Tata Merger,Tata Sons & Singapore Airlines celebrate Vistara’s merger with Air India,CNBC TV18,18 Nov 2024,https://www.cnbctv18.com/business/aviation/tata-sons-singapore-airlines-celebrate-vistaras-merger-with-air-india-19511222.htm
Google,Tata Merger,Air India-Vistara merger completed: Tata-group airline becomes India’s largest international carrier; here’s how,mint,12 Nov 2024,https://www.livemint.com/companies/news/air-india-vistara-merger-completes-singapore-airlines-to-invest-rs-3-194-5-crore-in-indias-largest-international-carti-11731413602450.html
Google,Tata Merger,"Vistara merger done, Singapore Airlines now 25.1% stakeholder in Tata's Air India",Times of India,12 Nov 2024,https://timesofindia.indiatimes.com/business/india-business/vistara-merger-done-singapore-airlines-now-25-1-stakeholder-in-tatas-air-india/articleshow/115216286.cms
Bing,Tata Merger,"Mohini Mohan Dutta: 'Mystery man' of Ratan Tata's will, set to get richer by Rs 500 crore due to...",Msn,48m,https://www.msn.com/en-in/money/topstories/mohini-mohan-dutta-mystery-man-of-ratan-tatas-will-set-to-get-richer-by-rs-500-crore-due-to/ar-AA1yJRBs?ocid=BingNewsVerp
Bing,Tata Merger,"Latest Car and Bike News Live Updates Today February 10, 2025: 2025 Tata Tigor gets a new top end variant. Here’s what the new variant has to offer",Msn,2h,https://www.msn.com/en-in/autos/hybrids/latest-car-and-bike-news-live-updates-today-february-10-2025-2025-tata-tigor-gets-a-new-top-end-variant-here-s-what-the-new-variant-has-to-offer/ar-AA1yItlI?ocid=BingNewsVerp
Bing,Tata Merger,"1:1 Split: Tata's Auto Stock Climbs On Big Demerger Update, Shantanu Naidu Gets Top Role; 18 Brokers Give BUY",Goodreturns,5d,https://www.goodreturns.in/personal-finance/1-1-split-tatas-auto-stock-tata-motors-climbs-big-demerger-update-shantanu-naidu-18-brokers-say-buy-1404265.html
Bing,Tata Merger,"Who is Mohini Mohan Dutta, the man who gets ₹500 crore in Ratan Tata’s will",Cnbctv18,3d,https://www.cnbctv18.com/business/ratan-tata-will-names-mystery-beneficiary-who-is-mohini-mohan-dutta-19554257.htm
Bing,Tata Merger,Mohini Mohan Dutta: The Mystery Man Who May Inherit Ratan Tata's Rs 500 Crore,Ndtv,3d,https://www.ndtv.com/india-news/mohini-mohan-dutta-the-mystery-man-who-may-inherit-ratan-tatas-rs-500-crore-7654369
Bing,Tata Merger,Ratan Tata bequeaths ₹500 crore to mystery man; Who is Mohini Mohan Dutta?,Fortuneindia,3d,https://www.fortuneindia.com/enterprise/ratan-tata-bequeaths-500-crore-to-mystery-man-who-is-mohini-mohan-dutta/120446
Bing,Tata Merger,Who Is Mohini Mohan Dutta? Ratan Tata’s Will Leaves Rs 500 Crore to Mystery Beneficiary,Newsx,3d,https://www.newsx.com/business/who-is-mohini-mohan-dutta-ratan-tatas-will-leaves-rs-500-crore-to-mystery-beneficiary/
Bing,Tata Merger,Merger mania: Will big listed companies get to skip the company court?,Livemint,5d,https://www.livemint.com/companies/nclt-mergers-and-acquisitions-cci-finance-minister-nirmala-sitharaman-kwality-wall-cyril-amarchand-mangaldas-11738587825301.html
Bing,Tata Merger,Who is Mohini Mohan Dutta? Mystery man to inherit Ratan Tata's USD 57 million will,Msn,2d,https://www.msn.com/en-in/news/other/who-is-mohini-mohan-dutta-mystery-man-to-inherit-ratan-tata-s-usd-57-million-will/ar-AA1yBpSo?ocid=BingNewsVerp
Bing,Tata Merger,Tata Capital sets stage for IPO with articles of association update,Business-standard,9d,https://www.business-standard.com/markets/ipo/tata-capital-sets-stage-for-ipo-with-articles-of-association-update-125013101256_1.html
Yahoo,Tata Merger,"Ratan Tata, austere Indian tycoon who bought Jaguar Land Rover but lost a fortune on British steel",The Telegraph·  via Yahoo Finance,4 months ago,https://r.search.yahoo.com/_ylt=Awr49Wr74qlnIuEjgxXQtDMD;_ylu=Y29sbwNncTEEcG9zAzEEdnRpZAMEc2VjA3Ny/RV=2/RE=1739215740/RO=10/RU=https%3a%2f%2ffinance.yahoo.com%2fnews%2fratan-tata-austere-indian-tycoon-150523359.html%3ffr%3dsycsrp_catchall/RK=2/RS=xWstvdqOW6Y0Maeter6OaU_kSis-
Yahoo,Tata Merger,"Disney strikes deal to sell stake in India's Tata Play, Bloomberg News reports",Reuters·  via Yahoo News,9 months ago,https://r.search.yahoo.com/_ylt=Awr49Wr74qlnIuEjhRXQtDMD;_ylu=Y29sbwNncTEEcG9zAzIEdnRpZAMEc2VjA3Ny/RV=2/RE=1739215740/RO=10/RU=https%3a%2f%2fwww.yahoo.com%2ftech%2fdisney-strikes-deal-sell-stake-161500438.html/RK=2/RS=jkICw2md8nKCmbe5.fd2dsCoy7k-
Yahoo,Tata Merger,"India's Tata Sons raises stake in Tata Play, Temasek exits, Economic Times reports",Reuters·  via Yahoo Finance,9 months ago,https://r.search.yahoo.com/_ylt=Awr49Wr74qlnIuEjhxXQtDMD;_ylu=Y29sbwNncTEEcG9zAzMEdnRpZAMEc2VjA3Ny/RV=2/RE=1739215740/RO=10/RU=https%3a%2f%2ffinance.yahoo.com%2fnews%2findias-tata-sons-raises-stake-034639433.html%3ffr%3dsycsrp_catchall/RK=2/RS=WVqwLX4Dx55MKm_lCyLiQ8kE2n8-
Yahoo,Tata Merger,Disney Is Said to Sell Stake in Tata’s India TV Platform,Bloomberg·  via Yahoo Finance,9 months ago,https://r.search.yahoo.com/_ylt=Awr49Wr74qlnIuEjiRXQtDMD;_ylu=Y29sbwNncTEEcG9zAzQEdnRpZAMEc2VjA3Ny/RV=2/RE=1739215740/RO=10/RU=https%3a%2f%2ffinance.yahoo.com%2fnews%2fdisney-said-sell-stake-tata-022649109.html%3ffr%3dsycsrp_catchall/RK=2/RS=36dac1FTHWfp3noh00hjbRkjZYY-
Yahoo,Tata Merger,Air India CEO meets India antitrust chief on pending Vistara merger -sources,Reuters·  via Yahoo Finance,2 years ago,https://r.search.yahoo.com/_ylt=Awr49Wr74qlnIuEjixXQtDMD;_ylu=Y29sbwNncTEEcG9zAzUEdnRpZAMEc2VjA3Ny/RV=2/RE=1739215740/RO=10/RU=https%3a%2f%2ffinance.yahoo.com%2fnews%2fair-india-ceo-meets-india-112842687.html%3ffr%3dsycsrp_catchall/RK=2/RS=dp7QsBNW0CYyDTsB1SVNF_vGpeQ-
Yahoo,Tata Merger,Air India strives to revive its fortunes with Tata money,Reuters·  via Yahoo Finance,2 years ago,https://r.search.yahoo.com/_ylt=Awr49Wr74qlnIuEjjRXQtDMD;_ylu=Y29sbwNncTEEcG9zAzYEdnRpZAMEc2VjA3Ny/RV=2/RE=1739215740/RO=10/RU=https%3a%2f%2ffinance.yahoo.com%2fnews%2fair-india-strives-revive-fortunes-153729188.html%3ffr%3dsycsrp_catchall/RK=2/RS=3t62on5L.bsE8Afil6bxt2TS27U-
Yahoo,Tata Merger,Deal to create one of world’s largest airline groups gets regulator approval,The Independent US·  via AOL,5 months ago,https://r.search.yahoo.com/_ylt=Awr49Wr74qlnIuEjjxXQtDMD;_ylu=Y29sbwNncTEEcG9zAzcEdnRpZAMEc2VjA3Ny/RV=2/RE=1739215740/RO=10/RU=https%3a%2f%2fwww.aol.com%2fdeal-create-one-world-largest-114826582.html/RK=2/RS=ofbYOx6nyuTDt7OYW.A2wtwxyjc-
Yahoo,Tata Merger,Air India to operate Vistara flights from November as merger gets key approval,Reuters·  via Yahoo Finance,5 months ago,https://r.search.yahoo.com/_ylt=Awr49Wr74qlnIuEjkRXQtDMD;_ylu=Y29sbwNncTEEcG9zAzgEdnRpZAMEc2VjA3Ny/RV=2/RE=1739215740/RO=10/RU=https%3a%2f%2ffinance.yahoo.com%2fnews%2fsingapore-airlines-gets-indias-fdi-004403487.html%3ffr%3dsycsrp_catchall/RK=2/RS=PfEJaZkL55TMi2c8ysd4JvUhSOc-
Yahoo,Tata Merger,,Investing.com·  via Yahoo Finance,1 year ago,
Yahoo,Tata Merger,"India flags antitrust concerns with Air India, Vistara merger -sources",Reuters·  via Yahoo Finance,2 years ago,https://r.search.yahoo.com/_ylt=Awr49Wr74qlnIuEjlBXQtDMD;_ylu=Y29sbwNncTEEcG9zAzEwBHZ0aWQDBHNlYwNzcg--/RV=2/RE=1739215740/RO=10/RU=https%3a%2f%2ffinance.yahoo.com%2fnews%2findia-antitrust-body-examining-air-042537209.html%3ffr%3dsycsrp_catchall/RK=2/RS=aSylmxz2_Mp7F51nlCQwcOjXOFY-
Google,Tata Bankruptcy,"Meet India’s first female tennis Olympian whose diamond saved Tata Steel from bankruptcy, she is Ratan Tata’s",India.Com,4 Nov 2024,https://www.india.com/business/meet-indias-first-female-tennis-olympian-lady-meherbai-tata-whose-diamond-saved-tata-steel-from-bankruptcy-she-is-ratan-tatas-aunt-7367214/
Google,Tata Bankruptcy,Ratan Tata got 'revenge' by buying Jaguar and Land Rover after facing 'humiliation' by Ford | INSIDE STORY,India TV News,10 Oct 2024,https://www.indiatvnews.com/business/news/ratan-tata-got-revenge-by-buying-jaguar-and-land-rover-after-facing-humiliation-by-ford-2008-deal-2024-10-10-956468
Google,Tata Bankruptcy,When Ratan Tata took revenge on Bill Ford 9 years after ‘humiliation’,Hindustan Times,10 Oct 2024,https://www.hindustantimes.com/india-news/when-ratan-tata-took-revenge-on-bill-ford-9-years-after-humiliation-101728548303854.html
Google,Tata Bankruptcy,"How Ford's insult led Ratan Tata to buy Jaguar, Land Rover",Times of India,10 Oct 2024,https://timesofindia.indiatimes.com/business/india-business/how-fords-insult-led-ratan-tata-to-buy-jaguar-land-rover/articleshow/114119073.cms
Google,Tata Bankruptcy,How Ratan turned TaMo into an automotive powerhouse,Deccan Herald,10 Oct 2024,https://www.deccanherald.com/business/how-ratan-turned-tamo-into-an-automotive-powerhouse-3227916
Google,Tata Bankruptcy,TATA Steel’s Acquisition of Bhushan Steel: CESTAT Rules Appeals Abate Post NCLT RP Approval Under IBC,Taxscan,1 month ago,https://www.taxscan.in/tata-steel-took-over-bhushan-steel-cestat-clarifies-appeals-are-abated-post-rp-approval-by-nclt-under-ibc-it-becomes-functus-officio/473401/
Google,Tata Bankruptcy,Is the Altman Z-Score Method Still Relevant in Predicting Bankruptcy? A Study,ResearchGate,22 Oct 2024,https://www.researchgate.net/publication/377210591_Is_the_Altman_Z-Score_Method_Still_Relevant_in_Predicting_Bankruptct_A_Study_on_PT_ESTIKA_TATA_TIARA_TBK_from_2019-2021
Google,Tata Bankruptcy,"Meet man, Ratan Tata ousted him from three Tata firms, his airline went bankrupt, still one of India's riches",India.Com,1 month ago,https://www.india.com/business/meet-man-ratan-tata-ousted-him-from-three-tata-firms-his-airline-went-bankrupt-still-one-of-indias-richest-with-net-worth-of-rs-44000-crores-his-son-is-ness-wadia-7470806/
Google,Tata Bankruptcy,TATA Health Navigates Financial Challenges Amid Bankruptcy,TipRanks,1 month ago,https://www.tipranks.com/news/company-announcements/tata-health-navigates-financial-challenges-amid-bankruptcy
Google,Tata Bankruptcy,Once India-bound EV startup Fisker files for bankruptcy,HT Auto,18 Jun 2024,https://auto.hindustantimes.com/auto/electric-vehicles/indiabound-ev-startup-fisker-files-for-bankruptcy-41718695865554.html
Bing,Tata Bankruptcy,"Meet man who business went bankrupt, net worth is still Rs 43894 crore, his name is..., business was...",Msn,1d,https://www.msn.com/en-in/money/topstories/meet-man-who-business-went-bankrupt-net-worth-is-still-rs-43894-crore-his-name-is-business-was/ar-AA1yGr4n?ocid=BingNewsVerp
Bing,Tata Bankruptcy,Tatas infuse money in ferro allow unit in Bishnupur,Thestatesman,1d,https://www.thestatesman.com/business/tatas-infuse-money-in-ferro-allow-unit-in-bishnupur-1503395946.html
Bing,Tata Bankruptcy,"Meet man whose airline went bankrupt, still has Rs 43894 crore net worth, he is...",Dnaindia,1d,https://www.dnaindia.com/business/report-meet-man-nusli-wadia-whose-airline-went-bankrupt-still-has-rs-43894-crore-net-worth-3131492
Bing,Tata Bankruptcy,"Meet India's first female Tennis Olympian, whose diamond once saved Tata Steel from bankruptcy, was wife of…",Dnaindia,3mon,https://www.dnaindia.com/education/report-meet-india-female-tennis-olympian-lady-meherbai-tata-diamond-once-saved-tata-steel-from-bankruptcy-3114331
Bing,Tata Bankruptcy,"Noel Tata scripts history, Tata Steel becomes first Indian company to…, helps India to achieve…",Msn,7d,https://www.msn.com/en-in/society-culture-and-history/history/noel-tata-scripts-history-tata-steel-becomes-first-indian-company-to-helps-india-to-achieve/ar-AA1yisZy?ocid=BingNewsVerp
Bing,Tata Bankruptcy,TATA Health Navigates Financial Challenges Amid Bankruptcy,Nasdaq,1mon,https://www.nasdaq.com/articles/tata-health-navigates-financial-challenges-amid-bankruptcy
Yahoo,Tata Bankruptcy,Go First's bankruptcy has fueled mass resignations and higher air fares,Quartz·  via Yahoo News,2 years ago,https://r.search.yahoo.com/_ylt=Awr49WoE46lnjeUjOBXQtDMD;_ylu=Y29sbwNncTEEcG9zAzEEdnRpZAMEc2VjA3Ny/RV=2/RE=1739215748/RO=10/RU=https%3a%2f%2fwww.yahoo.com%2ftech%2ffirsts-bankruptcy-fueled-mass-resignations-101500639.html/RK=2/RS=oBIE92j2gErnKJ4GLxg7lo_2g7g-
Yahoo,Tata Bankruptcy,"India's Go First touts owner, govt backing after bankruptcy filing",Reuters·  via Yahoo Finance,2 years ago,https://r.search.yahoo.com/_ylt=Awr49WoE46lnjeUjOhXQtDMD;_ylu=Y29sbwNncTEEcG9zAzIEdnRpZAMEc2VjA3Ny/RV=2/RE=1739215748/RO=10/RU=https%3a%2f%2ffinance.yahoo.com%2fnews%2findigo-shares-surge-smaller-rival-043606652.html%3ffr%3dsycsrp_catchall/RK=2/RS=A.buc.0D.nfgNHx3Rp0cbUtEW4w-
Yahoo,Tata Bankruptcy,"India's Go First airline gains bankruptcy protection, lessors' woes deepen",Reuters·  via Yahoo Finance,2 years ago,https://r.search.yahoo.com/_ylt=Awr49WoE46lnjeUjPBXQtDMD;_ylu=Y29sbwNncTEEcG9zAzMEdnRpZAMEc2VjA3Ny/RV=2/RE=1739215748/RO=10/RU=https%3a%2f%2ffinance.yahoo.com%2fnews%2findia-decide-first-bankruptcy-lessors-022933627.html%3ffr%3dsycsrp_catchall/RK=2/RS=DRwnq7urFwYzPVsOpieyo5YrfXE-
Yahoo,Tata Bankruptcy,"India's Go First airline files for bankruptcy, blames Pratt & Whitney engines",Reuters·  via Yahoo Finance,2 years ago,https://r.search.yahoo.com/_ylt=Awr49WoE46lnjeUjPhXQtDMD;_ylu=Y29sbwNncTEEcG9zAzQEdnRpZAMEc2VjA3Ny/RV=2/RE=1739215748/RO=10/RU=https%3a%2f%2ffinance.yahoo.com%2fnews%2findias-first-airline-files-bankruptcy-101608770.html%3ffr%3dsycsrp_catchall/RK=2/RS=4VKi.n7u6wjZtCi8RiQ8TVHmkso-
Yahoo,Tata Bankruptcy,Is JinkoSolar Holding Co (JKS) Too Good to Be True? A Comprehensive Analysis of a Potential ...,GuruFocus.com·  via Yahoo Finance,1 year ago,https://r.search.yahoo.com/_ylt=Awr49WoE46lnjeUjQBXQtDMD;_ylu=Y29sbwNncTEEcG9zAzUEdnRpZAMEc2VjA3Ny/RV=2/RE=1739215748/RO=10/RU=https%3a%2f%2ffinance.yahoo.com%2fnews%2fjinkosolar-holding-co-jks-too-233747157.html%3ffr%3dsycsrp_catchall/RK=2/RS=HKhjJol1j8nRgQRVLxFwOp1FEJM-
Yahoo,Tata Bankruptcy,Is Viasat (VSAT) Too Good to Be True? A Comprehensive Analysis of a Potential Value Trap,GuruFocus.com·  via Yahoo Finance,1 year ago,https://r.search.yahoo.com/_ylt=Awr49WoE46lnjeUjQhXQtDMD;_ylu=Y29sbwNncTEEcG9zAzYEdnRpZAMEc2VjA3Ny/RV=2/RE=1739215748/RO=10/RU=https%3a%2f%2ffinance.yahoo.com%2fnews%2fviasat-vsat-too-good-true-234134524.html%3ffr%3dsycsrp_catchall/RK=2/RS=6e0dckQmkQAqtXaBmHbmkmlgXHs-
Yahoo,Tata Bankruptcy,When You're Here You're Family: The New Neighborhood Beauty Shops,Town & Country·  via Yahoo News,1 year ago,https://r.search.yahoo.com/_ylt=Awr49WoE46lnjeUjRBXQtDMD;_ylu=Y29sbwNncTEEcG9zAzcEdnRpZAMEc2VjA3Ny/RV=2/RE=1739215748/RO=10/RU=https%3a%2f%2fwww.yahoo.com%2flifestyle%2fyoure-youre-family-neighborhood-beauty-180000890.html%3ffr%3dsycsrp_catchall/RK=2/RS=Q6S_g8_b3Jg2vGIHzbUJiiP6h5A-
Yahoo,Tata Bankruptcy,"Influencer Selling Hamptons Estate, Moving to Miami After Husband’s Suicide",The Daily Beast·  via Yahoo News,6 months ago,https://r.search.yahoo.com/_ylt=Awr49WoE46lnjeUjRhXQtDMD;_ylu=Y29sbwNncTEEcG9zAzgEdnRpZAMEc2VjA3Ny/RV=2/RE=1739215748/RO=10/RU=https%3a%2f%2fwww.yahoo.com%2fentertainment%2finfluencer-selling-hamptons-estate-moving-161611211.html%3ffr%3dsycsrp_catchall/RK=2/RS=uHrsQtcprXKAQ4ZVi1Fe9dC3PFY-
Yahoo,Tata Bankruptcy,India is now the most populous country in the world. And it’s ready to become a tourism force,CNN·  via Yahoo News,2 years ago,https://r.search.yahoo.com/_ylt=Awr49WoE46lnjeUjSBXQtDMD;_ylu=Y29sbwNncTEEcG9zAzkEdnRpZAMEc2VjA3Ny/RV=2/RE=1739215748/RO=10/RU=https%3a%2f%2fnews.yahoo.com%2findia-now-most-populous-country-015347798.html%3ffr%3dsycsrp_catchall/RK=2/RS=fczQuLsryF3Em58SPab6K42TJPg-
Yahoo,Tata Bankruptcy,'Risky jurisdiction': Aircraft lessors raise alarm over Go First crisis in India,Reuters·  via Yahoo Finance,2 years ago,https://r.search.yahoo.com/_ylt=Awr49WoE46lnjeUjShXQtDMD;_ylu=Y29sbwNncTEEcG9zAzEwBHZ0aWQDBHNlYwNzcg--/RV=2/RE=1739215748/RO=10/RU=https%3a%2f%2ffinance.yahoo.com%2fnews%2frisky-jurisdiction-aircraft-lessors-raise-113848087.html%3ffr%3dsycsrp_catchall/RK=2/RS=5WFAZ7ADJrqOSJPZ26vSPz8JwKI-
Google,Jio Lawsuits,JioHotstar vs Delhi Techie: What is Domain Squatting and can there be legal action?,Digit,25 Oct 2024,https://www.digit.in/news/general/jiohotstar-vs-delhi-techie-what-is-domain-squatting-and-can-there-be-legal-action.html
Google,Jio Lawsuits,"Disney, Fox, Warner Bros drop Venu Sports appeal after Fubo merger deal",Business Standard,1 month ago,https://www.business-standard.com/world-news/disney-fox-warner-bros-drop-venu-sports-appeal-after-fubo-merger-deal-125010601332_1.html
Google,Jio Lawsuits,"Reliance threatening legal action, says techie who asked for ₹1 crore to give up JioHotstar domain",Hindustan Times,24 Oct 2024,https://www.hindustantimes.com/entertainment/web-series/reliance-threatening-legal-action-says-techie-who-asked-for-1-crore-to-give-up-jiohotstar-domain-101729763104503.html
