search_engine,search_string,title,media,timestamp,link
Google,Tata Lawsuits,"From Singur, Mistry, Tata Tapes to Wadia: 5 controversies during Ratan Tata’s tenure",The Indian Express,11 Oct 2024,https://indianexpress.com/article/business/ratan-tata-singur-mistry-tata-tapes-wadia-controversies-9613283/
Google,Tata Lawsuits,"More than 20 fired American workers have sued TCS, why and IT giant's response",Times of India,31 Mar 2024,https://timesofindia.indiatimes.com/technology/tech-news/more-than-20-fired-americans-workers-of-tcs-have-sued-the-company-what-are-the-allegations-and-it-giants-response/articleshow/108906267.cms
Google,Tata Lawsuits,TCS accused of firing US workers in favour of Indians on H-1B visa,Business Standard,12 Apr 2024,https://www.business-standard.com/companies/news/tcs-accused-of-firing-us-workers-in-favour-of-indians-on-h-1b-visa-124041200156_1.html
Google,Tata Lawsuits,"Tata Fired White US Workers in Favor of Visa Holders, Suit Says",Bloomberg Law News,9 Apr 2024,https://news.bloomberglaw.com/daily-labor-report/tata-fired-white-us-workers-in-favor-of-visa-holders-suit-says
Google,Tata Lawsuits,Exclusive | Fired Americans Say Indian Firm Gave Their Jobs to H-1B Visa Holders,WSJ,29 Mar 2024,https://www.wsj.com/business/fired-americans-say-indian-firm-gave-their-jobs-to-h-1b-visa-holders-6da7cf26
Google,Tata Lawsuits,TCS Asked To Pay $210 Million Fine To DXC Technology In Trade Secrets Row,Outlook Business,27 Nov 2023,https://www.outlookbusiness.com/news/tcs-asked-to-pay-210-million-fine-to-dxc-technology-in-trade-secrets-row
Google,Tata Lawsuits,Dutch group threatens lawsuit over Tata Steel pollution,The Economic Times,24 Aug 2023,https://m.economictimes.com/industry/indl-goods/svs/steel/dutch-group-threatens-lawsuit-over-tata-steel-pollution/articleshow/103022889.cms
Google,Tata Lawsuits,"Third court case launched against Tata Steel, calls for closure",DutchNews.nl,27 May 2024,https://www.dutchnews.nl/2024/05/third-court-case-launched-against-tata-steel-calls-for-closure/
Google,Tata Lawsuits,TCS gets partial relief in racial discrimination lawsuit in US Court,mint,23 Aug 2023,https://www.livemint.com/companies/news/tata-group-tcs-gets-partial-relief-in-racial-discrimination-lawsuit-in-us-court-11692762412299.html
Google,Tata Lawsuits,US Supreme Court rejects Indian IT company's appeal in Epic trade secrets case,FierceHealthcare,21 Nov 2023,https://www.fiercehealthcare.com/health-tech/us-supreme-court-rejects-indian-it-companys-appeal-epic-trades-secret-case
Google,Tata Lawsuits,Tata-Mistry dispute: Behind Nusli Wadia's decision to withdraw lawsuits against Ratan Tata,Business Today,14 Jan 2020,https://www.businesstoday.in/latest/economy-politics/story/tata-mistry-dispute-behind-nusli-wadia-decision-to-withdraw-lawsuits-against-ratan-tata-242651-2020-01-14
Google,Tata Lawsuits,Mahindra Responds To IndiGo’s Lawsuit For Using The ‘6e’ Term In ‘BE 6e’ Branding,CarDekho,3 Dec 2024,https://www.cardekho.com/india-car-news/mahindra-responds-to-indigos-lawsuit-for-using-the-6e-term-in-be-6e-branding-33603.htm
Google,Tata Lawsuits,"What is the DXC lawsuit, for which TCS faces a penalty of $210 million?",Jagran Josh,28 Nov 2023,https://www.jagranjosh.com/general-knowledge/what-is-the-dxc-lawsuit-for-which-tcs-faces-a-penalty-of-210-million-dollar-1701184180-1
Google,Tata Lawsuits,"Tata Group unit owes $210 mln in US trade-secret fight, jury says",Reuters,21 Nov 2023,https://www.reuters.com/legal/litigation/tata-group-unit-owes-210-mln-us-trade-secret-fight-jury-says-2023-11-21/
Google,Tata Lawsuits,TCS gets some relief in discrimination lawsuit,The Economic Times,22 Aug 2023,https://m.economictimes.com/tech/information-tech/tcs-gets-some-relief-in-discrimination-lawsuit/articleshow/102954071.cms
Google,Tata Lawsuits,"TCS fined Rs 1,600 crore by the US court on complaint of this US-based company, here's the company's BSE",Times of India,21 Jun 2024,https://timesofindia.indiatimes.com/technology/tech-news/tcs-fined-rs-16000-crore-by-the-us-court-on-complaint-of-this-us-based-company-heres-the-companys-bse-filing/articleshow/111036958.cms
Google,Tata Lawsuits,TCS faces $210 million penalty in DXC lawsuit,The Economic Times,27 Nov 2023,https://m.economictimes.com/tech/information-tech/tcs-faces-210-million-penalty-in-dxc-lawsuit/articleshow/105527977.cms
Google,Tata Lawsuits,US techie sues TCS for discrimination against Americans and favouring Indians on H-1B visas,The Economic Times,12 Apr 2024,https://m.economictimes.com/nri/work/us-techie-sues-tcs-for-discrimination-against-americans-and-favouring-indians-on-h-1b-visas/articleshow/109237855.cms
Google,Tata Lawsuits,TCS to take $125-m hit in Q3 over Epic lawsuit,BusinessLine,22 Nov 2023,https://www.thehindubusinessline.com/info-tech/tcs-to-take-125-m-hit-in-q3-over-epic-lawsuit/article67560870.ece
Google,Tata Lawsuits,TCS slapped with lawsuit by former US employee for racial discrimination,The Hindu BusinessLine,12 Dec 2022,https://www.thehindubusinessline.com/info-tech/tcs-slapped-with-lawsuit-by-former-us-employee-for-racial-discrimination/article66254950.ece
Google,Tata Lawsuits,Starbucks sued by group that calls its claim of ethical sourcing misleading,Business Standard,11 Jan 2024,https://www.business-standard.com/world-news/starbucks-sued-by-group-that-calls-its-claim-of-ethical-sourcing-misleading-124011100291_1.html
Google,Tata Lawsuits,"Influencer Candice Miller Sued for Nearly $200,000 in Unpaid Rent After Husband Brandon’s Death - E! Online",E! Online,18 Sept 2024,https://www.eonline.com/news/1407528/influencer-candice-miller-sued-for-nearly-s200-000-in-unpaid-rent-after-husband-brandons-death
Google,Tata Lawsuits,No coercive actions against Tata Communications in Rs. 991.5 Cr license fee demand,ETLegalWorld.com,21 Aug 2023,https://legal.economictimes.indiatimes.com/news/litigation/no-coercive-actions-against-tata-communications-in-rs-991-5-cr-license-fee-demand/102910592
Google,Tata Lawsuits,Breaking down SLAPP: Responding to and Overcoming Legal Challenges,Bar and Bench,4 Jan 2024,https://www.barandbench.com/columns/breaking-down-slapp-responding-to-and-overcoming-legal-challenges
Google,Tata Lawsuits,"Sivasankaran mulls lawsuit against Cyrus Mistry, Tata Tele",Times of India,9 Jul 2018,https://timesofindia.indiatimes.com/business/india-business/sivasankaran-mulls-lawsuit-against-cyrus-mistry-tata-tele/articleshow/64920383.cms
Google,Tata Lawsuits,India's TCS to take $125 mln hit to Q3 earnings over US lawsuit,Reuters,21 Nov 2023,https://www.reuters.com/technology/indias-tcs-take-125-mln-hit-q3-earnings-over-us-lawsuit-2023-11-21/
Google,Tata Lawsuits,Hamptons socialite Candice Miller sued for nearly $200K in unpaid rent after husband's suicide,The Express Tribune,18 Sept 2024,https://tribune.com.pk/story/2496993/hamptons-socialite-candice-miller-sued-for-nearly-200k-in-unpaid-rent-after-husbands-suicide
Google,Tata Lawsuits,Tata Consultancy Services ordered to cough up $210M in code theft trial,The Register,24 Nov 2023,https://www.theregister.com/2023/11/24/tata_210m_code_theft/
Google,Tata Lawsuits,"12 years on, Supreme Court to take up Ratan Tata's privacy plea in Radia tapes case",Times of India,31 Aug 2022,https://timesofindia.indiatimes.com/india/12-years-on-supreme-court-to-take-up-ratan-tatas-privacy-plea-in-radia-tapes-case/articleshow/93889789.cms
Google,Tata Lawsuits,What Happened to 'Mama & Tata' Influencer Candice Miller?,Newsweek,14 Aug 2024,https://www.newsweek.com/mama-tata-candice-miller-brandon-hamptons-house-sale-1939327
Google,Tata Lawsuits,"Pallonji Mistry, the billionaire who can’t spend his own fortune",Hindustan Times,21 Aug 2018,https://www.hindustantimes.com/business-news/pallonji-mistry-has-17-billion-locked-up-in-legal-battle-with-tata-group/story-Ekehg9wQ39Llx3MLlyWiCN.html
Google,Tata Lawsuits,"Ratan Tata vs Niira Radia Tapes: After 8 years, SC to hear case that shook India's corporate and media world",Business Today,1 Sept 2022,https://www.businesstoday.in/latest/corporate/story/ratan-tata-vs-niira-radia-tapes-after-8-years-sc-to-hear-case-that-shook-indias-corporate-and-media-world-346159-2022-09-01
Google,Tata Lawsuits,Tata Consultancy Beats Whistleblower's H-1B Visa Fraud Lawsuit,Bloomberg Law News,8 Feb 2024,https://news.bloomberglaw.com/federal-contracting/tata-consultancy-beats-whistleblowers-h-1b-visa-fraud-lawsuit
Google,Tata Lawsuits,Shapoor Mistry & family,Forbes,13 Oct 2022,https://www.forbes.com/profile/shapoor-mistry/
Google,Tata Lawsuits,Indian fishing community tests World Bank immunity before US Supreme Court,International Consortium of Investigative Journalists - ICIJ,1 Nov 2018,https://www.icij.org/investigations/world-bank/indian-fishing-community-tests-world-bank-immunity-before-us-supreme-court/
Google,Tata Lawsuits,"Dead real estate mogul Brandon Miller owed more than $100K for luxury furniture rental, $50K for boat: suits",New York Post,9 Jul 2024,https://nypost.com/2024/07/09/business/dead-real-estate-mogul-brandon-miller-owed-more-than-100k-for-luxury-furniture-rental-suit/
Google,Tata Lawsuits,Ending “absolute immunity” for the International Finance Corporation: The legacy of Jam v. IFC,Bretton Woods Project,21 Jul 2022,https://www.brettonwoodsproject.org/2022/07/ending-absolute-immunity-for-the-international-finance-corporation-the-legacy-of-jam-v-ifc/
Google,Tata Lawsuits,TCS fined $940m in US for ‘stealing’ healthcare software,Times of India,17 Apr 2016,https://timesofindia.indiatimes.com/business/india-business/tcs-fined-940m-in-us-for-stealing-healthcare-software/articleshow/51853815.cms
Google,Tata Lawsuits,Legal Clean-Up: Air India Aims To Resolve Over 600 Pending Cases,Simple Flying,9 Sept 2023,https://simpleflying.com/air-india-over-600-pending-cases/
Google,Tata Lawsuits,"Late real estate mogul Brandon Miller owed more than $100K for luxury furniture, $50K for boat: suits",Page Six,9 Jul 2024,https://pagesix.com/2024/07/09/gossip/late-real-estate-mogul-brandon-miller-owed-money-for-furniture-boat/
Google,Tata Lawsuits,"BF.7 variant of coronavirus not worrisome for India, assures Tata Institute for Genetics and Society director",Deccan Herald,22 Dec 2022,https://www.deccanherald.com/india/bf7-variant-of-coronavirus-not-worrisome-for-india-assures-tata-institute-for-genetics-and-society-director-1174291.html
Google,Tata Lawsuits,World Bank lending arm sees off lawsuit by Indian fishermen,The Guardian,30 Mar 2016,https://www.theguardian.com/global-development/2016/mar/30/world-bank-lending-arm-ifc-sees-off-lawsuit-by-indian-fishermen-power-plant
Google,Tata Lawsuits,Socialite's mogul husband was being sued for over $221k when he died,MSN,9 Jul 2024,https://www.msn.com/en-us/money/companies/socialite-s-mogul-husband-was-being-sued-for-over-221k-when-he-died/ar-BB1pGUQj
Google,Tata Lawsuits,Supreme Court rejects World Bank coal case,E&E News by POLITICO,25 Apr 2022,https://www.eenews.net/articles/supreme-court-rejects-world-bank-coal-case/
Google,Tata Lawsuits,"Airtel-Tata Tele deal: C Sivasankaran to drag Cyrus Mistry to court for causing him Rs 3,000 crore loss",Firstpost,10 Jul 2018,https://www.firstpost.com/business/airtel-tata-tele-deal-c-sivasankaran-to-drag-cyrus-mistry-to-court-for-causing-him-rs-3000-crore-loss-4705841.html
Google,Tata Lawsuits,Supreme Court Rules that World Bank Group Can Be Sued in US Courts In Historic Decision,Center for International Environmental Law | CIEL,27 Feb 2019,https://www.ciel.org/news/supreme-court-rules-world-bank-group-immunity-jam-v-ifc/
Google,Tata Lawsuits,India’s TCS Defends U.S. Visa Use in Anti-White Worker Bias Case,Bloomberg.com,3 Oct 2017,https://www.bloomberg.com/news/articles/2017-10-03/india-s-tcs-defends-u-s-visa-use-in-anti-white-worker-bias-case
Google,Tata Lawsuits,"2,000 people join class action lawsuit against Tata Steel",NL Times,24 Sept 2023,https://nltimes.nl/2023/09/24/2000-people-join-class-action-lawsuit-tata-steel
Google,Tata Lawsuits,U.S. Supreme Court Rules That World Bank Can Be Sued,NPR,7 Mar 2019,https://www.npr.org/sections/goatsandsoda/2019/03/07/699437482/supreme-court-rules-that-world-bank-can-be-sued
Google,Tata Lawsuits,"No Longer Above The Law, The World Bank Faces Fight Of Its Life",International Consortium of Investigative Journalists - ICIJ,13 Mar 2019,https://www.icij.org/investigations/world-bank/no-longer-above-the-law-the-world-bank-faces-fight-of-its-life/
Bing,Tata Lawsuits,"Delhi HC bars unauthorized use of Ratan Tata's name, logo for events",Msn,1h,https://www.msn.com/en-in/autos/news/delhi-hc-bars-unauthorized-use-of-ratan-tata-s-name-logo-for-events/ar-AA1yAiKF?ocid=BingNewsVerp
Bing,Tata Lawsuits,Tata's Capital Foods sues Dabur over ‘Schezwan Chutney’ trademark: Report,Hindustantimes,22d,https://www.hindustantimes.com/business/tatas-capital-foods-sues-dabur-over-schezwan-chutney-trademark-report-101736930903962.html
Bing,Tata Lawsuits,Tata buys majority stake in iPhone-maker Pegatron's India unit,Newsbytesapp,13d,https://www.newsbytesapp.com/news/business/tata-acquires-60-stake-in-pegatron-india-apple-s-assembly-partner/story
Bing,Tata Lawsuits,"Tata Sales Breakup Dec 2024 – Punch, Nexon, Tiago, Curvv, Altroz, Safari, Harrier, Tigor",Rushlane,26d,https://www.rushlane.com/tata-sales-breakup-dec-2024-punch-nexon-tiago-12515764.html
Bing,Tata Lawsuits,Tata Technologies shares rally over 3% on signing deal with Telechips to make software-defined vehicles,Economictimes,29d,https://economictimes.indiatimes.com/markets/stocks/news/tata-technologies-shares-rally-over-3-on-signing-deal-with-telechips-to-make-software-defined-vehicles/articleshow/117049166.cms
Bing,Tata Lawsuits,Tata Electronics gets CCI's clearance to acquire majority stake in Pegatron India,Economictimes,1mon,https://economictimes.indiatimes.com/industry/cons-products/electronics/tata-electronics-gets-ccis-clearance-to-acquire-majority-stake-in-pegatron-india/articleshow/117029538.cms
Bing,Tata Lawsuits,"Two Sharp with ET: Maya & Leah Tata join SRTII Board | Markets sink on Dollar surge, FII outflows",Economictimes,28d,https://economictimes.indiatimes.com/markets/stocks/news/two-sharp-with-et-maya-leah-tata-join-srtii-board-markets-sink-on-dollar-surge-fii-outflows/videoshow/117089037.cms
Bing,Tata Lawsuits,"Tata Sons ends debt support for new businesses, focus on independent financing",Economictimes,1mon,https://economictimes.indiatimes.com/news/company/corporate-trends/tata-sons-ends-debt-support-for-new-businesses-focus-on-independent-financing/articleshow/116971235.cms
Bing,Tata Lawsuits,"Months after Ratan Tata's death, Tata Group changes THIS years old tradition, company will now...",Dnaindia,1mon,https://www.dnaindia.com/business/report-months-after-ratan-tata-death-tata-group-changes-this-years-old-tradition-company-will-now-3125749
Bing,Tata Lawsuits,Tata Capital listing hopes drive group company shares,Msn,1mon,https://www.msn.com/en-in/money/events?eventId=92538327.enin&ocid=BingNewsVerp
Bing,Tata Lawsuits,"Mahindra vs IndiGo: Trademark clash over '6E' sparks legal battle, automaker to approach court",Msn,2mon,https://www.msn.com/en-in/autos/news/mahindra-vs-indigo-trademark-clash-over-6e-sparks-legal-battle-automaker-to-approach-court/ar-AA1vrmw7?ocid=BingNewsVerp
Bing,Tata Lawsuits,One of India’s most valuable companies has been hit with a second lawsuit for improper use’ of a software provider’s source code,Businessinsider,5y,https://www.businessinsider.in/tata-consultancy-services-gets-hit-with-second-lawsuit-for-stealing-software-code/articleshow/69111034.cms
Bing,Tata Lawsuits,Here’s why Nykaa is suing Tata Cliq CEO Gopal Asthana,Msn,5mon,https://www.msn.com/en-in/news/other/here-s-why-nykaa-is-suing-tata-cliq-ceo-gopal-asthana/ar-AA1q29B2?ocid=BingNewsVerp
Yahoo,Tata Lawsuits,India's TCS to take $125 million hit to Q3 earnings over US lawsuit,Reuters·  via Yahoo Finance,1 year ago,https://r.search.yahoo.com/_ylt=Awr49Wqj5qVnbWAFkGHQtDMD;_ylu=Y29sbwNncTEEcG9zAzEEdnRpZAMEc2VjA3Ny/RV=2/RE=1738954531/RO=10/RU=https%3a%2f%2ffinance.yahoo.com%2fnews%2findias-tcs-125-million-hit-115115682.html%3ffr%3dsycsrp_catchall/RK=2/RS=4pnqBFZwU1DxK3rHHZyLW7yz938-
Yahoo,Tata Lawsuits,"Real estate mogul, husband of Mama + Tata influencer dead at 43",NY Post·  via Yahoo News,7 months ago,https://r.search.yahoo.com/_ylt=Awr49Wqj5qVnbWAFkmHQtDMD;_ylu=Y29sbwNncTEEcG9zAzIEdnRpZAMEc2VjA3Ny/RV=2/RE=1738954531/RO=10/RU=https%3a%2f%2fwww.yahoo.com%2fnews%2freal-estate-mogul-husband-mama-191725327.html%3ffr%3dsycsrp_catchall/RK=2/RS=jCDMKrsQ13v1KkWdcyHugyccDRo-
Yahoo,Tata Lawsuits,Mama & Tata Influencer Candice Miller Saddled with Husband’s $33.6 Million Debt After His Death by Suicide: Report,People·  via Yahoo News,1 month ago,https://r.search.yahoo.com/_ylt=Awr49Wqj5qVnbWAFlGHQtDMD;_ylu=Y29sbwNncTEEcG9zAzMEdnRpZAMEc2VjA3Ny/RV=2/RE=1738954531/RO=10/RU=https%3a%2f%2fwww.yahoo.com%2fnews%2fmama-tata-influencer-candice-miller-224820000.html%3ffr%3dsycsrp_catchall/RK=2/RS=iitQHpodAxTeYmPz83Ty8FP.Dkw-
Yahoo,Tata Lawsuits,Mama & Tata Influencer Candice Miller Selling $15 Million Hamptons Home 1 Month After Husband Brandon's Death,People·  via AOL,6 months ago,https://r.search.yahoo.com/_ylt=Awr49Wqj5qVnbWAFlmHQtDMD;_ylu=Y29sbwNncTEEcG9zAzQEdnRpZAMEc2VjA3Ny/RV=2/RE=1738954531/RO=10/RU=https%3a%2f%2fwww.aol.com%2fmama-tata-influencer-candice-miller-170622813.html/RK=2/RS=4ZA33Z_z6.DjsF7IOTg72Qm9k4s-
Yahoo,Tata Lawsuits,Hundreds of Items Auctioned Off from Former Home of Mama & Tata Influencer Candice Miler After Late Husband’s Death,People·  via Yahoo News,1 month ago,https://r.search.yahoo.com/_ylt=Awr49Wqj5qVnbWAFmGHQtDMD;_ylu=Y29sbwNncTEEcG9zAzUEdnRpZAMEc2VjA3Ny/RV=2/RE=1738954531/RO=10/RU=https%3a%2f%2fwww.yahoo.com%2fnews%2fmama-tata-influencer-candice-miller-162003406.html%3ffr%3dsycsrp_catchall/RK=2/RS=B45HRc3lpJD5C3SHEu41_mAnNPY-
Yahoo,Tata Lawsuits,TCS Revamps Organization Structure to Leverage Domain Knowledge,Bloomberg·  via Yahoo Finance,2 years ago,https://r.search.yahoo.com/_ylt=Awr49Wqj5qVnbWAFmmHQtDMD;_ylu=Y29sbwNncTEEcG9zAzYEdnRpZAMEc2VjA3Ny/RV=2/RE=1738954531/RO=10/RU=https%3a%2f%2ffinance.yahoo.com%2fnews%2ftcs-revamps-organization-structure-leverage-082432871.html%3ffr%3dsycsrp_catchall/RK=2/RS=T6DO7gatWFQIM2pyQZ1ETNhrA0I-
Yahoo,Tata Lawsuits,Everything Apple says is wrong about the DOJ’s iPhone lawsuit,Digital Trends·  via Yahoo News,10 months ago,https://r.search.yahoo.com/_ylt=Awr49Wqj5qVnbWAFnGHQtDMD;_ylu=Y29sbwNncTEEcG9zAzcEdnRpZAMEc2VjA3Ny/RV=2/RE=1738954531/RO=10/RU=https%3a%2f%2fwww.yahoo.com%2ftech%2feverything-apple-says-wrong-doj-180017657.html/RK=2/RS=4bVoD2h8zUCAOzFobRPt.z.sztY-
Yahoo,Tata Lawsuits,Influencer Candice Miller selling personal items after late husband amassed $33.6m debt,The Independent·  via Yahoo News,1 month ago,https://r.search.yahoo.com/_ylt=Awr49Wqj5qVnbWAFnmHQtDMD;_ylu=Y29sbwNncTEEcG9zAzgEdnRpZAMEc2VjA3Ny/RV=2/RE=1738954531/RO=10/RU=https%3a%2f%2fwww.yahoo.com%2fnews%2finfluencer-candice-miller-selling-personal-181930540.html%3ffr%3dsycsrp_catchall/RK=2/RS=fv3yTn0yUCois9haKU5u3em4Oc0-
Yahoo,Tata Lawsuits,"Chief executives of Air India, Akasa joust over poaching of pilots",Reuters·  via Yahoo Finance,1 year ago,https://r.search.yahoo.com/_ylt=Awr49Wqj5qVnbWAFoGHQtDMD;_ylu=Y29sbwNncTEEcG9zAzkEdnRpZAMEc2VjA3Ny/RV=2/RE=1738954531/RO=10/RU=https%3a%2f%2ffinance.yahoo.com%2fnews%2fchief-executives-air-india-akasa-075037899.html%3ffr%3dsycsrp_catchall/RK=2/RS=l2yRBDklxm2w20bG.Q_ulZ6YAow-
Yahoo,Tata Lawsuits,"Messi still out, Suarez may rest for Inter Miami vs. Tigres Leagues Cup game in Houston",Miami Herald·  via Yahoo Sports,6 months ago,https://r.search.yahoo.com/_ylt=Awr49Wqj5qVnbWAFomHQtDMD;_ylu=Y29sbwNncTEEcG9zAzEwBHZ0aWQDBHNlYwNzcg--/RV=2/RE=1738954531/RO=10/RU=https%3a%2f%2fsports.yahoo.com%2fmessi-still-suarez-may-rest-214315586.html%3ffr%3dsycsrp_catchall/RK=2/RS=BJm8zHBFNiJdEWQ3ITnC7jeU4i8-
Google,Tata Merger,"Tata Capital, Tata Motors Finance merger receives RBI's approval",Business Standard,14 Oct 2024,https://www.business-standard.com/companies/news/tata-capital-tata-motors-finance-merger-receives-rbi-s-approval-124101401020_1.html
Google,Tata Merger,"Tata Tech, just merge with Tata Elxsi",The Ken,1 week ago,https://the-ken.com/story/tata-tech-just-merge-with-tata-elxsi/
Google,Tata Merger,How are Tata Group companies linked? Why Tata Capital’s IPO could unlock value across conglomerate,Upstox,1 month ago,https://upstox.com/news/business-news/latest-updates/explained-why-tata-capital-s-potential-ipo-impacting-tata-group-stocks-how-are-the-companies-linked/article-136880/
Google,Tata Merger,NCLT asks two Tata NBFCs to seek merger nod from stakeholders,The Economic Times,7 Dec 2024,https://m.economictimes.com/industry/banking/finance/banking/nclt-asks-two-tata-nbfcs-to-seek-merger-nod-from-stakeholders/articleshow/116056343.cms
Google,Tata Merger,Tata Sons & Singapore Airlines celebrate Vistara’s merger with Air India,CNBC TV18,18 Nov 2024,https://www.cnbctv18.com/business/aviation/tata-sons-singapore-airlines-celebrate-vistaras-merger-with-air-india-19511222.htm
Google,Tata Merger,Air India-Vistara Merger: Strategic Win or Tata’s Gamble?,Skift,17 Sept 2024,https://skift.com/2024/09/17/air-india-vistara-merger-strategic-win-or-tatas-gamble/
Google,Tata Merger,"Merger with Tata Motors Finance will broaden Tata Capital’s product portfolio, says Fitch",The Hindu BusinessLine,24 Jun 2024,https://www.thehindubusinessline.com/companies/merger-with-tata-motors-finance-will-broaden-tata-capitals-product-portfolio-says-fitch/article68327326.ece
Google,Tata Merger,Air India-Vistara merger completed: Tata-group airline becomes India’s largest international carrier; here’s how,mint,12 Nov 2024,https://www.livemint.com/companies/news/air-india-vistara-merger-completes-singapore-airlines-to-invest-rs-3-194-5-crore-in-indias-largest-international-carti-11731413602450.html
Google,Tata Merger,Tata Capital and Tata Motors Finance merger: NCLT asks NBFCs to seek shareholders' nod,ET Now,7 Dec 2024,https://www.etnownews.com/companies/tata-capital-and-tata-motors-finance-merger-nclt-asks-nbfcs-to-seek-shareholders-nod-article-116063123
Google,Tata Merger,"Vistara merger done, Singapore Airlines now 25.1% stakeholder in Tata's Air India",Times of India,12 Nov 2024,https://timesofindia.indiatimes.com/business/india-business/vistara-merger-done-singapore-airlines-now-25-1-stakeholder-in-tatas-air-india/articleshow/115216286.cms
Google,Tata Merger,CCI Approves Proposed Merger Of Tata Motors Finance Limited With Tata Capital Limited,Live Law,12 Sept 2024,https://www.livelaw.in/consumer-cases/cci-approves-proposed-merger-of-tata-motors-finance-limited-with-tata-capital-limited-269464
Google,Tata Merger,Air India-Vistara merger finalised – Tata Group's airline now India's biggest international carrier - Airlines/Aviation News,Financialexpress,13 Nov 2024,https://www.financialexpress.com/business/airlines-aviation-air-india-vistara-merger-finalised-tata-groups-airline-now-indias-biggest-international-carrier-3663996/
Google,Tata Merger,'Air India-Vistara merger important milestone to transform it into world-class global airline': Tata Group chairman N Chandrasekaran,Business Today,14 Nov 2024,https://www.businesstoday.in/industry/aviation/story/air-india-vistara-merger-important-milestone-to-transform-it-into-world-class-global-airline-tata-group-chairman-n-chandrasekaran-453831-2024-11-14
Google,Tata Merger,Demerger of CV business undertaking of Tata Motors Ltd into a separate listed company,Tata Motors,1 Aug 2024,https://www.tatamotors.com/press-releases/demerger-of-cv-business-undertaking-of-tata-motors-ltd-into-a-separate-listed-company/
Google,Tata Merger,Tata Motors Finance merger with Tata Capital gets CCI approval,CNBC TV18,10 Sept 2024,https://www.cnbctv18.com/market/tata-motors-finance-merger-with-tata-capital-gets-cci-approval-19474176.htm
Google,Tata Merger,CCI clears proposed merger of Tata Motors Finance into Tata Capital,Business Standard,10 Sept 2024,https://www.business-standard.com/companies/news/cci-clears-proposed-merger-of-tata-motors-finance-into-tata-capital-124091001168_1.html
Google,Tata Merger,"Vedanta, UltraTech, Tata Motors among 8 mergers and demergers to track",The Economic Times,1 week ago,https://m.economictimes.com/markets/stocks/news/vedanta-ultratech-tata-motors-among-8-mergers-and-demergers-to-track/corporate-radar/slideshow/117677020.cms
Google,Tata Merger,Bharti Airtel-Tata Play entity may not have representatives from Tata Group on board,Business Today,1 month ago,https://www.businesstoday.in/latest/corporate/story/bharti-airtel-tata-play-entity-may-not-have-representatives-from-tata-group-on-board-459793-2025-01-07
Google,Tata Merger,CCI approves Tata Motors Finance merger with Tata Capital,The Economic Times,10 Sept 2024,https://m.economictimes.com/industry/banking/finance/cci-approves-tata-motors-finance-merger-with-tata-capital/articleshow/113231964.cms
Google,Tata Merger,CCI okays merger of Tata Motors Finance and Tata Capital. Key details,Business Today,10 Sept 2024,https://www.businesstoday.in/latest/corporate/story/cci-approves-merger-of-tata-motors-finance-and-tata-capital-key-details-445340-2024-09-10
Google,Tata Merger,Air India Vistara Merger will Help Tata Save 500 Crore Yearly,Aviation A2Z,11 Nov 2024,https://aviationa2z.com/index.php/2024/11/11/air-india-vistara-merger-help-tata-500-crore-yearly/
Google,Tata Merger,Tata group mulls merging Tata Realty and Tata Projects,The Hindu BusinessLine,1 Oct 2024,https://www.thehindubusinessline.com/companies/tata-group-mulls-merging-tata-realty-and-tata-projects/article68706226.ece
